{
  "capacity_id": "CAP-013",
  "capacity_object_type": "universal_capacity",
  "module": "universal",
  "universal_capacity_ref": "",
  "name": "single_leg_control",
  "capacity_status": "draft",
  "approval_status": "pending",
  "clinical_approval_status": "not_approved",
  "executable": false,
  "runtime_integration": "none",
  "permitted_use": "capacity_metadata_only",
  "capacity_domain": "motor_control",
  "capacity_subdomain": "single_leg_control",
  "capacity_tags": [
    "single_leg_neuromuscular_control",
    "movement_quality"
  ],
  "body_region": [
    "lower_limb",
    "hip",
    "knee",
    "ankle"
  ],
  "related_tissues": [
    "lower_limb_general"
  ],
  "measured_by_assessment_categories": [
    "neuromuscular_control",
    "landing_quality"
  ],
  "improved_by_exercise_function_categories": [
    "motor_control",
    "balance_proprioception",
    "support_strength",
    "landing_control"
  ],
  "expressed_through_activity_domains": [
    "running",
    "landing_exposure",
    "change_of_direction"
  ],
  "required_by_demand_profiles": [
    "change_of_direction",
    "landing",
    "field_movement"
  ],
  "related_rehab_plan_blocks": [
    "motor_control_block",
    "support_strength_block"
  ],
  "evidence_state": "not_tested",
  "goal_sufficiency_status": "not_applicable",
  "confidence_status": "low_confidence",
  "allowed_when": [
    "future_governed_capacity_rule_context_only",
    "not_runtime_selectable",
    "requires_clinical_rule_governance_before_use"
  ],
  "blocked_when": [
    "runtime_selection",
    "prescription",
    "dosage_decision",
    "progression_decision",
    "readiness_decision",
    "rtt_rts_decision",
    "clearance_decision",
    "standard_selection_without_governed_capacity_rules"
  ],
  "notes": "Single-leg control quality; no embedded pass/fail test (assessment use lives in Assessment Knowledge). Universal human-capacity metadata only. This object does not authorize prescription, dosage, progression, readiness, RTT/RTS, or clearance, holds no score/threshold/timeline, and carries no user-specific state. RF-specific meaning belongs to a future RF-CAP overlay referencing this capacity via universal_capacity_ref."
}
