{
  "capacity_id": "CAP-009",
  "capacity_object_type": "universal_capacity",
  "module": "universal",
  "universal_capacity_ref": "",
  "name": "knee_flexion_tolerance",
  "capacity_status": "draft",
  "approval_status": "pending",
  "clinical_approval_status": "not_approved",
  "executable": false,
  "runtime_integration": "none",
  "permitted_use": "capacity_metadata_only",
  "capacity_domain": "movement_tolerance",
  "capacity_subdomain": "knee_flexion_tolerance",
  "capacity_tags": [
    "lengthened_anterior_thigh_tolerance",
    "range_under_load_tolerance"
  ],
  "body_region": [
    "knee",
    "anterior_thigh"
  ],
  "related_tissues": [
    "anterior_thigh_general",
    "knee_general"
  ],
  "measured_by_assessment_categories": [
    "range_of_motion",
    "pain_response",
    "next_day_response"
  ],
  "improved_by_exercise_function_categories": [
    "mobility",
    "long_length_strength",
    "eccentric_strength"
  ],
  "expressed_through_activity_domains": [
    "stairs",
    "kicking_exposure"
  ],
  "required_by_demand_profiles": [
    "end_range_mobility",
    "kicking"
  ],
  "related_rehab_plan_blocks": [
    "mobility_block",
    "tissue_loading_block",
    "monitoring_check"
  ],
  "evidence_state": "not_tested",
  "goal_sufficiency_status": "not_applicable",
  "confidence_status": "low_confidence",
  "allowed_when": [
    "future_governed_capacity_rule_context_only",
    "not_runtime_selectable",
    "requires_clinical_rule_governance_before_use"
  ],
  "blocked_when": [
    "runtime_selection",
    "prescription",
    "dosage_decision",
    "progression_decision",
    "readiness_decision",
    "rtt_rts_decision",
    "clearance_decision",
    "standard_selection_without_governed_capacity_rules"
  ],
  "notes": "Tolerance of loaded/lengthened knee flexion; no range-of-motion or dose values. Universal human-capacity metadata only. This object does not authorize prescription, dosage, progression, readiness, RTT/RTS, or clearance, holds no score/threshold/timeline, and carries no user-specific state. RF-specific meaning belongs to a future RF-CAP overlay referencing this capacity via universal_capacity_ref."
}
