{
  "capacity_id": "CAP-015",
  "capacity_object_type": "universal_capacity",
  "module": "universal",
  "universal_capacity_ref": "",
  "name": "movement_confidence",
  "capacity_status": "draft",
  "approval_status": "pending",
  "clinical_approval_status": "not_approved",
  "executable": false,
  "runtime_integration": "none",
  "permitted_use": "capacity_metadata_only",
  "capacity_domain": "psychological_confidence_capacity",
  "capacity_subdomain": "movement_confidence",
  "capacity_tags": [
    "movement_confidence",
    "qualitative_confidence"
  ],
  "body_region": [
    "whole_body_context"
  ],
  "related_tissues": [
    "not_applicable"
  ],
  "measured_by_assessment_categories": [
    "pain_response",
    "next_day_response"
  ],
  "improved_by_exercise_function_categories": [
    "motor_control",
    "conditioning_support",
    "sport_preparation_drill"
  ],
  "expressed_through_activity_domains": [
    "walking",
    "running",
    "kicking_exposure",
    "controlled_practice"
  ],
  "required_by_demand_profiles": [
    "field_movement",
    "court_movement"
  ],
  "related_rehab_plan_blocks": [
    "monitoring_check",
    "activity_exposure_block"
  ],
  "evidence_state": "not_tested",
  "goal_sufficiency_status": "not_applicable",
  "confidence_status": "low_confidence",
  "allowed_when": [
    "future_governed_capacity_rule_context_only",
    "not_runtime_selectable",
    "requires_clinical_rule_governance_before_use"
  ],
  "blocked_when": [
    "runtime_selection",
    "prescription",
    "dosage_decision",
    "progression_decision",
    "readiness_decision",
    "rtt_rts_decision",
    "clearance_decision",
    "standard_selection_without_governed_capacity_rules"
  ],
  "notes": "Qualitative movement-confidence capacity; never a readiness or clearance score, and distinct from return-to-sport or competition readiness. Universal human-capacity metadata only. This object does not authorize prescription, dosage, progression, readiness, RTT/RTS, or clearance, holds no score/threshold/timeline, and carries no user-specific state. RF-specific meaning belongs to a future RF-CAP overlay referencing this capacity via universal_capacity_ref."
}
