{
  "capacity_id": "CAP-010",
  "capacity_object_type": "universal_capacity",
  "module": "universal",
  "universal_capacity_ref": "",
  "name": "anterior_thigh_tissue_load_tolerance",
  "capacity_status": "draft",
  "approval_status": "pending",
  "clinical_approval_status": "not_approved",
  "executable": false,
  "runtime_integration": "none",
  "permitted_use": "capacity_metadata_only",
  "capacity_domain": "tissue_capacity",
  "capacity_subdomain": "anterior_thigh_tissue_load_tolerance",
  "capacity_tags": [
    "regional_tissue_load_tolerance",
    "anterior_thigh_load_tolerance"
  ],
  "body_region": [
    "anterior_thigh",
    "hip",
    "knee"
  ],
  "related_tissues": [
    "anterior_thigh_general",
    "quadriceps_general"
  ],
  "measured_by_assessment_categories": [
    "strength_capacity",
    "pain_response",
    "next_day_response"
  ],
  "improved_by_exercise_function_categories": [
    "isometric_strength",
    "isotonic_strength",
    "eccentric_strength",
    "long_length_strength"
  ],
  "expressed_through_activity_domains": [
    "running",
    "sprinting",
    "kicking_exposure"
  ],
  "required_by_demand_profiles": [
    "max_velocity_sprinting",
    "kicking",
    "linear_acceleration"
  ],
  "related_rehab_plan_blocks": [
    "tissue_loading_block",
    "strength_block",
    "monitoring_check"
  ],
  "evidence_state": "not_tested",
  "goal_sufficiency_status": "not_applicable",
  "confidence_status": "low_confidence",
  "allowed_when": [
    "future_governed_capacity_rule_context_only",
    "not_runtime_selectable",
    "requires_clinical_rule_governance_before_use"
  ],
  "blocked_when": [
    "runtime_selection",
    "prescription",
    "dosage_decision",
    "progression_decision",
    "readiness_decision",
    "rtt_rts_decision",
    "clearance_decision",
    "standard_selection_without_governed_capacity_rules"
  ],
  "notes": "General anterior-thigh tissue load tolerance (anatomical region, not pathology); no dosage. Universal human-capacity metadata only. This object does not authorize prescription, dosage, progression, readiness, RTT/RTS, or clearance, holds no score/threshold/timeline, and carries no user-specific state. RF-specific meaning belongs to a future RF-CAP overlay referencing this capacity via universal_capacity_ref."
}
