{
  "capacity_id": "CAP-007",
  "capacity_object_type": "universal_capacity",
  "module": "universal",
  "universal_capacity_ref": "",
  "name": "kicking_tolerance",
  "capacity_status": "draft",
  "approval_status": "pending",
  "clinical_approval_status": "not_approved",
  "executable": false,
  "runtime_integration": "none",
  "permitted_use": "capacity_metadata_only",
  "capacity_domain": "movement_tolerance",
  "capacity_subdomain": "kicking_tolerance",
  "capacity_tags": [
    "kicking_skill_tolerance",
    "high_demand_movement_tolerance"
  ],
  "body_region": [
    "lower_limb",
    "hip",
    "knee",
    "anterior_thigh"
  ],
  "related_tissues": [
    "lower_limb_general",
    "anterior_thigh_general"
  ],
  "measured_by_assessment_categories": [
    "kicking_tolerance",
    "pain_response",
    "next_day_response"
  ],
  "improved_by_exercise_function_categories": [
    "kicking_mechanics",
    "eccentric_strength",
    "support_strength"
  ],
  "expressed_through_activity_domains": [
    "kicking_exposure"
  ],
  "required_by_demand_profiles": [
    "kicking"
  ],
  "related_rehab_plan_blocks": [
    "sport_mechanics_block",
    "activity_exposure_block",
    "monitoring_check"
  ],
  "evidence_state": "not_tested",
  "goal_sufficiency_status": "not_applicable",
  "confidence_status": "low_confidence",
  "allowed_when": [
    "future_governed_capacity_rule_context_only",
    "not_runtime_selectable",
    "requires_clinical_rule_governance_before_use"
  ],
  "blocked_when": [
    "runtime_selection",
    "prescription",
    "dosage_decision",
    "progression_decision",
    "readiness_decision",
    "rtt_rts_decision",
    "clearance_decision",
    "standard_selection_without_governed_capacity_rules"
  ],
  "notes": "Kicking tolerance only; no kicking volume or intensity; not kicking clearance or return-to-sport. Universal human-capacity metadata only. This object does not authorize prescription, dosage, progression, readiness, RTT/RTS, or clearance, holds no score/threshold/timeline, and carries no user-specific state. RF-specific meaning belongs to a future RF-CAP overlay referencing this capacity via universal_capacity_ref."
}
